<?xml version="1.0" encoding="utf-8"?>
<xs:schema id="diaries" xmlns="" xmlns:xs="http://www.w3.org/2001/XMLSchema" xmlns:msdata="urn:schemas-microsoft-com:xml-msdata">
    <xs:element name="diaries" msdata:IsDataSet="true" msdata:Locale="en-US">
        <xs:complexType>
            <xs:choice minOccurs="0" maxOccurs="unbounded">
                <xs:element name="diary">
                    <xs:complexType>
                        <xs:sequence>
                            <xs:element name="entry" minOccurs="1" maxOccurs="unbounded">
                                <xs:complexType>
                                    <xs:sequence>
                                        <xs:element name="title" type="xs:string" minOccurs="1" msdata:Ordinal="0" />
                                        <xs:element name="location" type="xs:string" minOccurs="1" msdata:Ordinal="1" />
                                        <xs:element name="description" type="xs:string" minOccurs="1" msdata:Ordinal="2" />
                                        <xs:element name="images" minOccurs="0" maxOccurs="unbounded">
                                            <xs:complexType>
                                                <xs:sequence>
                                                    <xs:element name="image" nillable="true" minOccurs="0" maxOccurs="unbounded">
                                                        <xs:complexType>
                                                            <xs:simpleContent msdata:ColumnName="image_Text" msdata:Ordinal="0">
                                                                <xs:extension base="xs:string">
                                                                </xs:extension>
                                                            </xs:simpleContent>
                                                        </xs:complexType>
                                                    </xs:element>
                                                </xs:sequence>
                                            </xs:complexType>
                                        </xs:element>
                                    </xs:sequence>
                                    <xs:attribute name="date" type="xs:string" />
                                </xs:complexType>
                            </xs:element>
                        </xs:sequence>
                        <xs:attribute name="customer" type="xs:string" />
                    </xs:complexType>
                </xs:element>
            </xs:choice>
        </xs:complexType>
    </xs:element>
</xs:schema>